{
  "figure_goal": "",
  "paper_claim": "",
  "figure_type": "system-architecture",
  "mode": "openai-image",
  "panels": [
    {
      "name": "A",
      "purpose": "",
      "content": "",
      "evidence_or_data": ""
    }
  ],
  "semantic_nodes": [],
  "semantic_edges": [],
  "render_graph": {
    "reading_order": "left-to-right",
    "containers": [],
    "edge_routing": ""
  },
  "visible_text_allowlist": [],
  "must_keep_labels": [],
  "negative_constraints": [],
  "issue_ledger": [],
  "candidate_mode": "single",
  "data": {
    "not_applicable": true
  },
  "style_constraints": [
    "white background",
    "publication style",
    "short readable labels"
  ],
  "output_formats": ["png"],
  "verification_checklist": [
    "The figure supports the stated paper claim.",
    "All labels are readable at intended paper size.",
    "No unsupported numeric or scientific claims are shown."
  ]
}
